{"allocated_capital_usd":75000.0,"realised_pnl_usd":-9477.03,"unrealised_pnl_usd":-3518.14,"dyncap_usd":62004.83,"closed_count":27,"open_count":2,"marked_asof":"2026-10-19","note":"dynCap = allocation + realised + UNREALISED = current Aegis equity, mark-to-market (D-41). Computed AFTER Aegis-membership classify, AEGIS-only (D-99): realised sourced from the archive ledger + not-yet-archived closes (idempotent on re-run); unrealised excludes excluded_non_aegis positions. Single writer of this file -- tools/recompute_dyncap.py, run as PTJ CLOSE job 3.5. `premarket` step 8 reads this, it does not recompute it (2026-09-05)."}